{
  "schema_version": "schednav.accepted-decision/v1",
  "project_id": "proj-20260808-060606",
  "status": "completed",
  "outcome": "accepted",
  "selected_action_id": "repository-default-gfs",
  "selected_policy": {
    "scheduler": "spot_scheduler",
    "guarantee_rate": 0.9,
    "policy_fingerprint": "a7fe2f906bf44eddfbf40ca4c9c9284bdcd09663d3ebeb5dafee75f05ed425d2"
  },
  "ranking": {
    "selection_status": "tie_requires_human_approval",
    "ranking_fingerprint": "8752f40df9c9ef5edbc31be189bd6804c30ba4fc5d9eaf66488ba0c85fd083b3",
    "artifact_ref": "evidence/demo-v1/policy-ranking.json",
    "artifact_sha256": "4ce521ae5046bcdd5425cf8c5e1be8d0adeabeaab3346b9dbd67507d955561b4"
  },
  "final_approval": {
    "event_id": "$tsoSdbrIFMyNwaDnGSY7rGeRjjf1PLMpzb-FOwJztMk",
    "origin_server_ts": 1786176484556,
    "decision_maker": "@admin:matrix-local.agentteams.io:18080",
    "approved_at": "2026-08-08T08:08:04.556Z",
    "decision": "accept repository-default-gfs"
  },
  "selection_basis": "Human choice after a three-way evidence tie. Existing evidence does not show repository-default-gfs to be superior to gfs-quantile-080 or gfs-quantile-095.",
  "new_simulation_performed": false
}
